id,date,place,title,description,image
1,2026/01/04 (Sun), 2026/01/05 (Mon),ユアエルム八千代台 (1/4), ユアエルム成田 (1/5),岡本幸太＆澤田慶仁 新春ジョイントミニライブ,新年早々からユアエルム様2店舗にてミニライブ決定！！観覧無料。特典会あり。,/images/schedule/event1.jpeg
2,2025/12/07 (Sun),ミュージックパブ・ペア,自分の唄は歌いません？！企画vol.2 (Band Edition),今年はバンドメンバーも出演。チケット￥8,000 (お弁当・お茶付き)。,/images/schedule/event2.png
3,2025/07/06 (Sun),ミュージックパブ・ペア,自分の唄は歌いません？！企画vol.2 (Showa Songs),昭和100年企画！昭和歌謡で盛り上がろう。リクエスト曲を歌唱。,/images/schedule/event3.png
4,2025/06/15 (Sun),ガーデンホテル紫雲閣東松山,Kazuyuki Oketani Birthday Party,ディナーショー料金：￥10,000。ゲスト：ツートン青木、英二、澤田慶仁。,/images/schedule/event4.png
5,2025/04/13 (Sun),ユアエルム成田 1Fセンタープラザ,澤田慶仁×鋤焼～SUKIYAKI～ 和洋セッション Vol.1,観覧無料。和洋折衷のライブセッション。,/images/schedule/event5.png
6,2025/01/05 (Sun),Live & Song Crystal (草加市),カラオケ大会 発表会,観覧 ¥5,000、大会出場者 ¥8,000。BS12の番組出演権あり。,/images/schedule/event6.png
7,2024/12/08 (Sun),松山市民活動センター (東松山市),澤田慶仁 10周年記念コンサート,デビュー10周年を記念したホール単独公演。チケット ¥3,000。,/images/schedule/event7.jpeg
